<?xml version="1.0" encoding="UTF-8"?>
<!DOCTYPE matricula SYSTEM "ejercicio1.dtd">
<matricula>
    <cicle> Administració de sistemes informàtics i xarxes</cicle>
    <alumnes>
        <alumne>
        <nom>Federicu Pi</nom>
        <any>2010</any>
        <moduls>
            <modul>XML</modul>
            <modul>Xarxes Locals</modul>
        </moduls>
        </alumne>
    </alumnes>
</matricula>
